{
  "schema_version": 2,
  "tournament": {
    "id": "synthetic-cup",
    "display_name": "Synthetic Cup",
    "season": "2026"
  },
  "focus_team_id": "north-city",
  "teams": [
    {"id": "north-city", "display_name": "North City"},
    {"id": "river-town", "display_name": "River Town"},
    {"id": "harbor-united", "display_name": "Harbor United"},
    {"id": "summit-athletic", "display_name": "Summit Athletic"},
    {"id": "east-city", "display_name": "East City"},
    {"id": "valley-rovers", "display_name": "Valley Rovers"},
    {"id": "lakeside-fc", "display_name": "Lakeside FC"},
    {"id": "meadow-club", "display_name": "Meadow Club"}
  ],
  "stages": [
    {
      "id": "group-stage",
      "type": "round_robin_groups",
      "groups": {
        "A": ["north-city", "river-town", "harbor-united", "summit-athletic"],
        "B": ["east-city", "valley-rovers", "lakeside-fc", "meadow-club"]
      },
      "rounds_per_pair": 1,
      "points": {"win": 3, "draw": 1, "loss": 0},
      "tiebreakers": ["points", "goal_difference", "goals_for", "wins", "rating", "team_id"],
      "qualification": {"direct_per_group": 2, "best_additional": 0}
    },
    {
      "id": "semi-finals",
      "type": "knockout",
      "pairing": {
        "mode": "fixed",
        "ties": [
          {
            "id": "semi-final-1",
            "entrants": [
              {"type": "group_rank", "stage_id": "group-stage", "group": "A", "rank": 1},
              {"type": "group_rank", "stage_id": "group-stage", "group": "B", "rank": 2}
            ]
          },
          {
            "id": "semi-final-2",
            "entrants": [
              {"type": "group_rank", "stage_id": "group-stage", "group": "B", "rank": 1},
              {"type": "group_rank", "stage_id": "group-stage", "group": "A", "rank": 2}
            ]
          }
        ]
      },
      "legs": 1,
      "home_away_order": "listed_team_first_leg_home",
      "aggregate_tiebreak": "extra_time_then_penalties",
      "away_goals_rule": false
    },
    {
      "id": "final",
      "type": "knockout",
      "pairing": {
        "mode": "fixed",
        "ties": [
          {
            "id": "final-1",
            "entrants": [
              {"type": "match_winner", "match_id": "semi-final-1"},
              {"type": "match_winner", "match_id": "semi-final-2"}
            ]
          }
        ]
      },
      "legs": 1,
      "home_away_order": "listed_team_first_leg_home",
      "aggregate_tiebreak": "extra_time_then_penalties",
      "away_goals_rule": false,
      "terminal": "championship"
    }
  ],
  "ratings": {
    "north-city": 1640,
    "river-town": 1580,
    "harbor-united": 1530,
    "summit-athletic": 1490,
    "east-city": 1610,
    "valley-rovers": 1560,
    "lakeside-fc": 1510,
    "meadow-club": 1470
  },
  "completed_matches": [],
  "metadata": {"data_status": "project-authored synthetic redistributable test data"}
}
